[
  {
    "depositSuspended": true,
    "withdrawSuspended": false,
    "symbol": "BTC",
    "name": "Bitcoin",
    "icon": "https://assets.demo.local/icons/btc.svg",
    "coinGeckoId": "bitcoin",
    "minimumAmountToSweep": "0.0005",
    "gasLimit": "0",
    "networks": {
      "bitcoin": {
        "chain": "bitcoin",
        "decimals": 8
      }
    },
    "isNative": true,
    "assetAddress": "",
    "assetType": "native",
    "decimals": 8,
    "displayDecimals": 8,
    "isHidden": false
  },
  {
    "depositSuspended": false,
    "withdrawSuspended": false,
    "symbol": "USDT",
    "name": "Tether USD",
    "icon": "https://assets.demo.local/icons/usdt.svg",
    "coinGeckoId": "tether",
    "minimumAmountToSweep": "10",
    "gasLimit": "100000",
    "networks": {
      "ethereum": {
        "chain": "ethereum",
        "contractAddress": "0xdAC17F958D2ee523a2206206994597C13D831ec7",
        "decimals": 6
      },
      "tron": {
        "chain": "tron",
        "contractAddress": "TR7NHqjeKQxGTCi8q8ZY4pL8otSzgjLj6t",
        "decimals": 6
      }
    },
    "isNative": false,
    "assetAddress": "0xdAC17F958D2ee523a2206206994597C13D831ec7",
    "assetType": "erc20",
    "decimals": 6,
    "displayDecimals": 2,
    "isHidden": false
  },
  {
    "depositSuspended": false,
    "withdrawSuspended": false,
    "symbol": "ARB",
    "name": "Arbitrum",
    "icon": "https://assets.coingecko.com/coins/images/16547/large/arb.jpg",
    "coinGeckoId": "arbitrum",
    "minimumAmountToSweep": "0.1",
    "gasLimit": "0",
    "networks": {
      "arbitrum": {
        "chain": "arbitrum",
        "contractAddress": "0x912CE59144191C1204E64559FE8253a0e49E6548",
        "decimals": 18
      }
    },
    "isNative": false,
    "assetAddress": "0x912CE59144191C1204E64559FE8253a0e49E6548",
    "assetType": "erc20",
    "decimals": 18,
    "displayDecimals": 6,
    "isHidden": false
  },
  {
    "depositSuspended": false,
    "withdrawSuspended": false,
    "symbol": "AAARB",
    "name": "Arbitrum",
    "icon": "https://assets.coingecko.com/coins/images/16547/large/arb.jpg",
    "coinGeckoId": "arbitrum",
    "minimumAmountToSweep": "0.1",
    "gasLimit": "0",
    "networks": {
      "arbitrum": {
        "chain": "arbitrum",
        "contractAddress": "0x912CE59144191C1204E64559FE8253a0e49E6548",
        "decimals": 18
      }
    },
    "isNative": false,
    "assetAddress": "0x912CE59144191C1204E64559FE8253a0e49E6548",
    "assetType": "erc20",
    "decimals": 18,
    "displayDecimals": 6,
    "isHidden": false
  },
  {
    "depositSuspended": false,
    "withdrawSuspended": false,
    "symbol": "hmm",
    "name": "Arbitrum",
    "icon": "https://assets.coingecko.com/coins/images/16547/large/arb.jpg",
    "coinGeckoId": "arbitrum",
    "minimumAmountToSweep": "0.1",
    "gasLimit": "0",
    "networks": {
      "arbitrum": {
        "chain": "arbitrum",
        "contractAddress": "0x912CE59144191C1204E64559FE8253a0e49E6548",
        "decimals": 18
      }
    },
    "isNative": false,
    "assetAddress": "0x912CE59144191C1204E64559FE8253a0e49E6548",
    "assetType": "erc20",
    "decimals": 18,
    "displayDecimals": 6,
    "isHidden": false
  },
  {
    "depositSuspended": false,
    "withdrawSuspended": false,
    "symbol": "hmmmm",
    "name": "Arbitrum",
    "icon": "https://assets.coingecko.com/coins/images/16547/large/arb.jpg",
    "coinGeckoId": "arbitrum",
    "minimumAmountToSweep": "0.1",
    "gasLimit": "0",
    "networks": {
      "arbitrum": {
        "chain": "arbitrum",
        "contractAddress": "0x912CE59144191C1204E64559FE8253a0e49E6548",
        "decimals": 18
      }
    },
    "isNative": false,
    "assetAddress": "0x912CE59144191C1204E64559FE8253a0e49E6548",
    "assetType": "erc20",
    "decimals": 18,
    "displayDecimals": 6,
    "isHidden": false
  }
]
